{
  "id": "evt_01J9Z4P4BS0M9P2QJ6T8Z6W2EQ",
  "type": "audit.policy_decision.denied",
  "version": "0.1.0",
  "occurred_at": "2026-01-01T00:00:02.000Z",
  "source": "control_plane",
  "working_group_id": "wg_01J9Z4P4BS0M9P2QJ6T8Z6W2EP",
  "actor": {
    "type": "agent",
    "id": "agt_01J9Z4P4BS0M9P2QJ6T8Z6W2EP"
  },
  "resource": {
    "type": "provider",
    "id": "prv_01J9Z4P4BS0M9P2QJ6T8Z6W2EP"
  },
  "correlation_id": "corr_01J9Z4P4BS0M9P2QJ6T8Z6W2EP",
  "request_id": "req_01J9Z4P4BS0M9P2QJ6T8Z6W2EP",
  "policy_decision_id": "poldec_01J9Z4P4BS0M9P2QJ6T8Z6W2EP",
  "payload": {
    "action": "gateway.provider.invoke",
    "outcome": "denied"
  }
}
